Unnamed: 0,winery,country,points,description,designation
518,Sanguis,US,92,"Working from an urban winery on Santa Barbara's Eastside, Matthias Pippig created the Loner Chardonnay series. This entry begins with scents of cider, nectarine and lemon-lime soda before delving into a palate laden with yellow fruits and flowers. Sourdough yeastiness surrounds a lingering line of grapefruit zest-led acidity.",Loner W11-B
519,Quinta da Romaneira,Portugal,92,"A solid, firm wine with a great rapport between the black berry fruits, juicy acidity and dark tannins. It has a fresh element along with a powerful structure and dense mineral texture. It will age well, so drink from 2017.",
521,Luis Pato,Portugal,92,"This is a rich, full-bodied and wood-aged wine, produced from vines in the village of Panasqueira. It has herbal and mint flavors, with black fruit tones powered by structured tannins. It is impressive, ripe, and still maturing. Best after 2016.",Vinha Pan
522,Array,US,92,"Big points for subtlety, length and elegance here—this is not a wine that will blow you away at first sniff. Stay with it and it stays with you; opening sharp-edged, pungent and slightly grassy, then developing a tightly focused midpalate with pure lime and apple fruit flavors. Accents of mustard greens and white pepper come in as a long, delicate yet detailed finish slowly unfolds.",Conner Lee
523,Vie Winery,US,92,Scents of effervescent cherry and mint run with emergent licorice and slate on this wine that proves lithe yet flavorful on the palate. Lovely blackberry flavors and black pepper make for a very balanced bottling that doesn't rely on bombastic power to tell the Syrah story.,White Hawk Vineyard
524,Woodward Canyon,US,92,"This single-vineyard wine shows both the warmth of the vintage and the coolness of this site, boasting depth and richness to the fruit flavors while retaining good acidity. It combines notes of apple, peach and lees with light barrel accents—20% new French—and a creamy feel. Enjoy with shrimp stir fried in olive oil for a pairing nirvana.",Celilo Vineyard
525,Domaine Loew,France,92,"This is rich and full-bodied, a splendid wine with its ripe yellow fruits, intensely aromatic character and a pinch of pepper. Concentrated, it finishes with a light touch of toastiness that hints at the maturity to come. Drink from 2016.",Bruderbach Clos des Frères
526,Hugel,France,92,"Part of the impressive series of Jubilée wines that are aged before release, this Hugel Riesling is just getting to maturity with its soft aromatic character, touch of toastiness, and refreshing herbal flavors. It's now ready to drink, although it will be even better from 2016.",Jubiléé
527,Lafond,US,92,"This begins with scents of dried orange rinds and mango laced with honey as well as deeper aromas of rocks and savory herbs. A tight lemon acidity runs down the middle of the palate, with yellow flowers, yeast and toasted pine nuts on the side. It's both racy and rounded, and is showing a touch of age.",Melville Vineyard
528,Lynmar,US,92,"Honeysuckle and jasmine pique interest aromatically before luscious, linear waves of vanilla, caramel and lemon custard graciously interject, buoyed by ample acidity and a lush texture. This Chardonnay offers generous richness alongside high-toned minerality, and is a delicious go-to for buttery lobster dishes.",Quail Hill Vineyard
529,Royal Tokaji,Hungary,92,"This wine is straw in color, with delightful notes of lemon curds and apricot blossoms. On the palate, freshly picked apricot and Anjou pear provide the core to a slightly spiced backdrop, finishing crisp and clean. Pair this wine with your favorite spicy Asian dish.",
530,Ressia,Italy,92,"An appealing fragrance of red rose and violet mingled with a whiff of baking spices drifts out of the glass. The juicy palate offers crushed Morello cherry, vanilla, licorice and cinnamon alongside firm but fine tannins. It's a balanced, classic Barbaresco.",Canova
531,Rock Wall,US,92,"Abundant flavors combine with a plush texture to make a wine that slowly builds interest from the first sniff to the lingering aftertaste. Hints of vanilla and honeysuckle enhance the vivid apricot flavors, lasting long on the viscous palate and through the finish.",Kristen's Cuvee
532,Piazzo Armando,Italy,92,"Red berry, blue lilac, baking spice and Mediterranean herb lead the nose. On the palate, notes of white pepper, sage and tobacco back up the bright red cherry flavors. It's still young, with aggressive tannins and bright acidity. Drink after 2018.",Sottocastello di Novello Riserva
533,Château Marsau,France,92,"This special selection, tight-cropped from 30 acres of 100% Merlot, is ripe and rich. This is a smoky and fruity wine, in barrel for 14 months. It has ripe black fruits and rich, dense structure. Spice and toast balance the fruit, giving an impressive sense of generosity. Drink from 2017.",
534,Herdade do Rocim,Portugal,92,"From a small parcel of land on the slopes of the Serra de Aire hills, this firm textured, cool-climate wine shows structure and depth. The fruit weight is concentrated with plum and juicy black currant flavors, rotating around a dry core of tannins. Age this complex wine and drink after 2015.",Vale de Mata
535,Jean Becker,France,92,"The wine is pure minerality, tightly woven into a tense structure and fruits that are still very young. It's complex, allying fruit with a texture that is steely and only developing slowly. It will be impressive as it ages. Drink from 2018.",Mandelberg Grand Cru
536,Byron,US,92,"The aromas of this Chardonnay are zesty and fresh yet rich, with barrel smoke, caramelized pear and vanilla tones. The integration continues on the palate, with a bit of oak followed by apple, white peach, nectarine and lime zest. It's flavorful and enjoyable now.",Nielson Vineyard
537,Caliterra,Chile,92,"Deep, pure cassis and red berry aromas are integrated and thorough. This Bordeaux-style blend of Cabernet Sauvignon, Petit Verdot, Cabernet Franc and Merlot is racy, tight and hard-driving, with bold berry, pepper, baking spice and chocolate flavors. A toasty, peppery finish is juicy, forward and long. Drink through 2020.",Edición Limitada B
538,Force Majeure,US,92,"Winemaker Mark McNeilly from Mark Ryan Winery makes this estate grown Viognier, and works it in the same strong, substantial, concentrated style as his own release. The mix of concrete and neutral oak fermentation brings out some nice floral highlights and a light hint of toast. The length and flavor development through the long finish are exceptional.",Collaboration Series
539,Fort Ross,US,92,"Unctuous and ripe in caramel and toasty aromas, this is deep golden in color but completely crisp and balanced in the glass. The nose is so overwhelming that the flavors take time to show. Once they do, it's a celebration of green apple and melon enveloped in complex minerality and a supple body.",Fort Ross Vineyard
540,Easton,US,90,"This is a classic version of the varietal, matching complex herb and cherry aromas with fresh, frank fruit flavors that also show hints of mint, clove and anise. It is all about vibrancy and balance, not full body, and has a welcome, appetizing personality.",Monarch Mine Vineyards
541,Easton,US,90,"An interesting vein of tasty herb flavor runs through this full-bodied, plump and fruity wine. The aroma has hints of dill and sage, and these mingle with black cherry and blueberry on the palate. A sleek texture and long finish complete the picture.",
542,Kirsten,Germany,90,"Kirsten's Feinherb, or gently sweet bottling, maintains a firm foundation of stoniness, but also embraces softer, less angular dimensions of spring blossom and peach. High-toned acidity brighten and lifts the palate through a long finish. Drink now through 2021.",Feinherb
543,Labouré-Roi,France,90,"Situated close to the northern edge of Beaune vineyards, this premier cru has something of the soft ripeness of Savigny-lès-Beaune next door. The wine is ripe, with tannins that are present although certainly not dominant. It has the potential to revel in its red fruits and generous texture. Drink this wine from 2019.",Les Marconnets Premier Cru
544,Labouré-Roi,France,90,"This structured wine still has wood aromas although on the palate the rich, dark fruits dominate. The tannins both from wood and from the fruit are firm and still young, showing the possibility of long-term aging. This complex wine should not be drunk before 2019.",
545,MacMurray Ranch,US,90,"Quite a steal of a deal for a widely available wine, this shows cinnamon, red cherry, ripe cranberry, light tobacco and a touch of leather on the rustic nose. Once sipped, the mouthfeel is soft, offering flavors of cranberry and red cherry that are spiced by thyme, bay leaf and more cinnamon.",Estate Vineyards
546,MacPhail,US,90,"Hazelnut and truffle compete for affection in this juicy, rounded, lovable wine, a full-bodied and structured example from the appellation, known for its at-times generous portrait of tannin and wound-up concentration.",Sundawg Ridge Vineyard
547,Max Ferd. Richter,Germany,90,"Luscious white peach and apricot flavors are anchored by a steely core of mineral in this easy-drinking but elegant wine. Light bodied but persistent, it's a lip-smacking, sweet wine that finishes with a touch of brambly herbaceousness. Drink now through 2020.",Richter Estate
548,McCay Cellars,US,90,Aromas like wild berries and sage lead to moderate cherry and raspberry flavors in this medium-bodied wine. With each sip the fruit flavor seems to deepen and the finish seems to lengthen because of the wine's strong concentration and lively texture with just the right amount of tannin.,
549,Baglio del Cristo di Campobello,Italy,90,"This offers heady aromas of honeysuckle, white stone fruit, dill, hay and a vegetal note that recalls tomato leaf. The tangy palate offers juicy grapefruit, white peach and honeydew melon while mouthwatering salinity provides depth.",Laluci
550,Chanson Père et Fils,France,90,"Aromas of this wine show considerable wood. On the palate, the wood is very present, giving acidity as well as layers of toast and spice. Hints of yellow fruit show through, suggesting the possibility of a ripe, rich wine in the future. Drink from 2019.",Bastion Premier Cru
551,Domaine Barmès-Buecher,France,90,"A soft, stony scent of pebble and the faintest melon signals a fresh, clean wine. The palate plays these aromas out softly but also with precision. That stoniness lingers on the dry, gentle finish and the lasting flavor of fresh apple peel",Rosenberg
552,Domaine Collotte,France,90,"With tannins and new-wood flavors, this rich wine is also structured. A smoky character from the wood is shot through by perfumed red fruits. The aftertaste shows more of the wood flavors that need to integrate. Drink from 2018.",Clos de Jeu
553,Domaine Rieflé-Landmann,France,90,"Subtle hints of ripe, winter-stored apple on the nose lead to an equally apple-dominated palate that shows soft pepper spice. A wonderful midpalate texture and baked-apple richness are countered by lemon freshness. This is very appetizing and cries out for soft cheeses.",L'Aplomb
554,Domaine Weinbach,France,90,White summer blossoms and ripe green pears make for a fresh scent. The palate lifts these notions with bright lemon acidity. All is buoyed by some residual carbon dioxide. Drink soon while this is at its aromatic height.,Réserve
555,Elizabeth Chambers,US,90,"This is a sophisticated blend of tart yellow fruits with hints of cucumber, salad greens and lemon oil. Though 80% stainless steel fermented, the rest spent time in new oak. The mineral rich acids provide extra grip.",
556,Occhipinti,Italy,90,"Made entirely with Nero d'Avola, this offers aromas of black-skinned fruit, tilled earth and cake spice. The concentrated but also focused palate shows ripe black cherry and crushed raspberry while nutmeg and carob add depth. Lithe tannins and lively acidity provide the framework.",Siccagno
557,Ordaz Family Wines,US,90,"This youthful wine is shyer on the nose than its 2013 counterpart, but is still in development, revealing a complex and layered richness of red cherry and berry, as well as dried herb and lavender.",Montecillo Vineyard
558,Planeta,Italy,90,"Here's a lively Moscato made in a dry style that opens with heady scents of jasmine, citrus blossom and yellow stone fruit aromas. The vibrant palate tastes of apricot, tangerine zest and a note of botanical herb alongside fresh acidity.",Bianco Dry
559,Santo Wines,Greece,90,"Crisp acidity and a gorgeous, aromatic nose lead on this elegant white. Though mineral-driven, it offers generous white peach and grapefruit flavors that will pair well with fuller-bodied fish. Impressive and versatile.",
560,Soléna,US,90,"Among the well-differentiated single vineyard selections from Soléna in 2014, this may be the most instantly enjoyable. It's a big, mouth-coating wine, a full-flavored burst of chocolate-covered cherries. Lighter notes of coffee and tobacco filter in through the extended finish.",Guadalupe Vineyard
561,Stags' Leap Winery,US,90,"The oak in this wine is restrained, partly because it aged in stainless steel and a sizable percentage of neutral oak. Still, a richness of apple and pear compote provide a steady level of richness, while a lemon squeeze of acidity keeps it fresh and youthful.",
562,Terre di Giurfo,Italy,90,"Aromas of iris, rose, dark-skinned berry and a whiff of baking spice lead nose. The juicy, easy-drinking palate doles out fleshy wild cherry, black raspberry and black pepper alongside bright acidity and supple tannins. Chill this down for the perfect summer red.",Belsito
563,Boatique,US,90,"Seductive, spicy oak in the aromas and flavors puts a great spin on this medium-bodied, velvety smooth wine from a promising new winery in Northern California. Some ripe black-cherry and cranberry flavors chime in as well, supporting the toasted baguette, cedar and nutmeg nuances and layering seamlessly.",
564,Bodegas Muriel,Spain,90,"Baked, rooty aromas of sandalwood, exotic spices and berry fruits are attractive. Though slightly grabby on the palate, this shows the right structure and build. Flavors of up-front oak, herbal plum and raspberry finish dry, with firm, pinching tannins. Drink through 2021.",Fincas de la Villa Reserva
565,Burgo Viejo,Spain,90,"Berry and cinnamon aromas are lightly woody and spicy. This is tannic but not mean or fierce. Flavors of oaky plum and berry fruits turn savory in front of a finish with a dry, snappy, slightly raw feel. Given that 2013 was a cold vintage, this Crianza deserves praise.",Crianza
566,Chacewater,US,90,"This full-bodied wine combines deep, ripe fruit flavors, light spicy accents and a very firm mouthfeel that begs for a bite of a grilled rosemary lamb chop. The wine pushes the stereotype of wimpy Merlot out of the way and does it with fruit concentration rather than obvious oak. Drink through 2020.",Made with Organically Grown Grapes
567,Dr. H. Thanisch (Erben Thanisch),Germany,90,"Apple, pear and stone-fruit flavors are vibrant and fresh from nose to finish of this delicately sweet Kabinett. It offers uncomplicated refreshment, but is anchored with taut acidity and honed, steely minerality. The finish is long and persistent.",Bernkasteler Badstube Kabinett
568,Hahn,US,90,"A slightly herbal, minty character gives personality to this full-bodied, generous and richly textured wine. It is attractively dry, nicely tannic, layered with black cherry, wild berry and rosemary notes. Great to drink now through 2020 with rich meats or mushrooms.",
569,Lyeth,US,90,"An ambitious, concentrated, but not oaky wine, this has a very dark color, aromas of black cherries, and ripe but dry flavors of blackberries and dark chocolate. It is medium to full bodied, framed by lots of fine-grained tannins and finishing with more dark fruit. It's a good wine to lay down and drink after 2019.",
570,The Calling,US,94,"Cherry pie and nuanced spice flavors buoy this delicately layered, medium-bodied vineyard designate that's built of robust fruit and supported quietly by oak. A thread of white pepper persists throughout, making it especially irresistible.",Sunny View
571,Trisaetum,US,94,"An aromatic textural wine, Wichmann sources fruit from the winery's oldest vines. Strawberry and cherry flavors are woven into details of citrus and tea. This elegant well-proportioned effort provides a feminine contrast to the sturdy Coast Range bottling.",Wichmann Dundee Estate
572,Vignobles Brumont,France,94,"This is the home estate of Madiran superstar Alain Brumont. The wine is big, bold, rich and packed with both fruit and tannins. It has great structure and a dense dusty tannic character that promises great aging. This is a major wine that needs time. Drink it starting from 2022.",Château Bouscassé
573,Frank Family,US,94,"This tremendous red wine is robustly aromatic, layering its black currant, dark cherry and chocolate scents with dusty sage and cedar. Luxuriously textured and smooth, it finishes focused and direct, with a lift of welcome acidity and complexity.",Reserve
574,Ancien,US,94,"From a cool part of the Napa Valley, this wine is bright and medium bodied—a moderately oaked mix of lemon custard, floral citrus and green apple flavors with an underlying spark of lemongrass and ginger. Richly layered, it remains balanced and structured as it opens in the glass.",Haynes Old Block
575,Barden,US,94,"Many are now playing with the low-alcohol, nervy side of Chardonnay, but Doug Margerum succeeds more than most. This bottling is light in the glass, with clean and crisp Asian pear, nectarine and mandarin pith aromas. The palate is tightly wound and energetic, showing sharp citrus and rounded strone-fruit flavors. Drink now–2030.",
576,Borgo del Tiglio,Italy,94,"One of the finest whites of the vintage, this exquisite bottling has an enticing bouquet of almond, orchard fruit, almond and chopped herb. The elegantly structured palate delivers mouthwatering peach, apricot, almond and energizing mineral ntoes that carry over to the long, lingering finish, along with a hint of tangerine.",
577,Château de Gayon,France,94,"Eight years is about right for a Madiran to start its mature phase. This wine is just there, a ripe expression of Tannat. It still has tannins and they will remain, but the fruit has lost its raw youth and has become rich with dried fruits and acidity working well together. Drink this wine now and until 2025.",Dou Barringuet
578,Demetria,US,94,"This lovely, layered wine from the Santa Ynez Valley-based producer shows iron, cranberry, shiitake, cola and cherry on the nose. Those same elements are delicately woven into the palate, enhanced by a Sichuan peppercorn kick and vibrant acidity that will ensure a long life ahead. Its flavors continue to unwind as it opens in the glass.",Cuvée Sandre
579,Domaine Serene,US,94,"Aromatically compelling, this offers a complex mix of clover, chocolate and cherry in the nose. It is a substantial, fruit-packed wine, with cherry and plum fruit, a full-bodied midpalate, mouthfilling texture and nicely integrated barrel spices. It finishes with a streak of Meyer lemon acidity. Drink now through 2030.",Two Barns Vineyard
580,Château Lagrézette,France,93,"Produced from old Malbec vines in the second terrace above the River Lot, the wine is darkly concentrated, with solid tannins and generous black fruits. Aging for 12 months has smoothed the square corners to create a wine that is hugely rich and rounded. It has the potential to age and become more opulent. Drink from 2020.",Seigneur de Grézette
581,Cherry Pie,US,93,"Cloudy, pungent and supremely earthy, this wine reveals its delicate acidity over time, bringing balance to its flamboyant fruit. With intense strawberry, orange peel and black tea flavors, it's savory and richly built, finishing on a touch of smoky vanilla.",Rogers Creek
582,Johanneshof Reinisch,Austria,93,"Pepper and cinnamon strike first, before beautifully aromatic notions of blueberry, plum and tart black cherry appear. These scented fruits pervade the entire palate with spice, verve and freshness. A wonderfully poised Sankt Laurent at the perfect intersection of restrained freshness and glorious richness.",
583,21 Grams,US,93,"High-toned aromas of cranberry, herb, black licorice and dried cherry are followed by tightly wound dark-fruit flavors backed by firm tannins. The finish extends into the distance. It's a highly structured wine, with its best days far in front of it. Best from 2021 through 2027.",
584,Aperture,US,93,"Complemented with 11% Cabernet Franc, this vineyard designate from winemaker Jesse Katz shines in fragrant plum, raspberry and blackberry flavors. Softly layered and balanced, it teases with dark chocolate and clove hints.",Oliver's Vineyard
585,Babcock,US,93,"Baked red cherry, vanilla pastry, loam, dried mint and forest floor notes all show in this excellent bottling from Bryan Babcock's family vineyard. Its tannic structure is immediately apparent, framing a core of raspberry fruit rounded out with thyme, oregano, black pepper and sea salt flavors. Drink 2021–2029.",Ocean's Ghost Babcock Vineyard
586,Lleiroso,Spain,93,"Deep dark berry aromas come with notes of vanilla, gritty spice and tobacco. Hard tannins require cushion and this has just enough to handle things. Blackberry, cassis, barrel spice and molasses flavors finish with savory oak notes, chocolate and lingering blackberry fruit. Drink through 2030.",Reserva Edición Especial Sergio Hernández
587,Meinklang,Austria,93,"Juicy, vivid black cherry fruit appears on the nose of this wine, with a touch of tar and brooding elderberry. The palate brims with those appetizing flavors and adds an edge of licorice to the fruit. It's fresh and vibrant, with a fine, taut, gossamer structure. A delicious Pinot Noir that's as elegant as it is refreshing and honest.",
588,Muhr-Van der Niepoort,Austria,93,"Upon first pour, this only shows some earthy hints of evolution. With air, the aromas awaken and lovely notes hayflower notes emerge. The palate is laced with elderberry and dried oak leaf flavors and framed by smooth tannins. Just a little bottle age has given this an almost timeless elegance, proving a wine doesn't need power to shine, just depth. Drink now–2025.",
589,Nicora,US,93,"This bottling reveals that this historic vineyard can produce incredibly rich wine as well as the zestier styles it is known for. It shows black cherry, candied strawberry and bourbon-like spice on the nose. The mouthfeel is lavish, full of purple fruit and floral flavors, as well as peppery spice and vanilla warmth. The acidity and structure are solid, and there's a touch of tar on the finish.",Bien Nacido Vineyard
590,Parallel,US,93,"Crisp with peach and apricot goodness, this full-bodied white's gravelly texture works to its advantage, providing both steely acidity and grip. That grit becomes velvety smooth as the wine opens in the glass, making it irresistibly seductive and inviting.",
591,Patricia Green Cellars,US,93,"Fruit from the oldest blocks in this pioneering vineyard is sourced here. It's bright, spicy and focused, with forward citrus-scented Bing cherry flavors. The concentration and length are outstanding, with just the lightest suggestion of green herbs rounding out the finish.",Medici Vineyard
592,Renwood,US,93,"Bright, firmly structured and full of classic berry and savory flavors, this wine is rich but balanced and ready to serve with a steak, chop or rack for a special occasion. It has ripe fruit bolstered by firm acidity and a healthy coating of fine-grained, grippy tannins. Best after 2020.",Story Vineyard
593,Rusack,US,93,"Grown against all odds (and against all likelihood of economic viability) overlooking the Pacific Ocean atop Catalina Island, this Chardonnay is a success every vintage. It shows a broad spectrum of nutty aromas, from macadamia to cashew, with touches of honey and daffodil. On the palate, expect walnut, vanilla and oak smoke, with a butterscotch-like finish.",Santa Catalina Island Vineyards
594,Sbragia,US,93,"Another beauty from this producer and this appellation, Hughes is about granite-like minerality and rocky dust—a big-boned powerhouse from a powerful vintage that boasts generous spiced plum, cola, clove and black pepper flavors.",Hughes
595,Schwarz Wein,Austria,93,"Oak leaf, tart strawberry and supple vanilla aromas appear immediately on the nose and continue their smooth interplay on the mellow palate. This is pliable in texture but has depth, backbone and inherent freshness. Delicious now, it has an underlying taut structure that will benefit from some bottle age. Drink 2018–2025.",The Butcher
596,The Bridge,US,93,"A collaboration between Sonoma County-based winemaker Jesse Katz and Ken Forrester of South Africa, this 100% varietal red is robust and rich. Dark cherry, red currant and integrated oak flavors support its bold body.",A Ken Forrester Wine Farrow Ranch
597,Harney Lane,US,93,"This distinctive, complex and layered wine brings a unique aromatic profile of raspberries, sage and spice before fanning out across the palate with gorgeous raspberry syrup, dark chocolate and blackberry flavors. Its lightly grippy texture of fine-grained tannins perfectly counters the plush effusiveness of its fruit.",Scottsdale Vineyard
598,Pago de Carraovejas,Spain,93,"Like it's bigger sibling El Anejón, this Reserva from a warm vintage is almost one-quarter Cabernet Sauvignon and Merlot in addition to Tinto Fino (Tempranillo). The opening of burnt earth, brandied cherry, rubber and herbal aromas is distinct. This feels a bit tough and chewy, with boysenberry, cassis, vanilla-cream and herbal spice flavors. A fairly smooth finish is young and vital. This should improve with aging. Best from 2019–2026.",Reserva
