Unnamed: 0,winery,country,points,description,designation
1385,Pull,US,88,"Blackberry liqueur, violet, cola and slight dustiness form the nose of this well-priced wine. The flavors are a bit thinner than expected, most reminiscent of ripe pomegranate.",
1386,Rattalino,Italy,88,"Pretty aromas suggest plum, red berry, leather, graphite and eucalyptus. The understated palate isn't as expressive as the nose, but reveals subdued black cherry, black pepper, espresso and oak. Astringent tannins still need to integrate, but for now leave the mouth feeling dried out. Drink after 2020.",Trentaquattro34
1387,Red Pony Ranch,US,88,"The Red Pony brand is putting out reliably distinct wines. This one smells of cranberry, oregano and barnyard. The tannins and acidity are solid, with strawberry and pomegranate flavors leading to an earthy finish. Hold until 2016 for an even smoother time.",
1388,Andrea Oberto,Italy,88,"This opens with aromas of toasted oak, espresso and a hint of tire rubber. The palate displays sweet black cherry extract layered with milk chocolate, coffee and oak alongside bracing tannins and racy acidity. Drink after 2018.",Rocche dell'Annunziata
1389,Dominio IV,US,88,"The lightest wine in the winery's well-crafted lineup, this marries grapefruity acidity to tart cherry fruit. It's nicely balanced, airy and a pleasure to drink.",Mulberry Street Vitae Springs Vineyard
1390,Dominique Pabiot,France,88,"This tight, young wine is shot through with steely acidity and minerality. It tastes of the flinty soil of Pouilly, full in the mouth and concentrated. Give it until 2015 before drinking.",Cuvée Plaisir
1391,Elk Cove,US,88,"Crafted entirely from estate-grown fruit, this tart, citrus-flavored rosé is anchored in rhubarb and strawberry flavors. It offers medium concentration and length, with a subtle suggestion of cola woven into the finish.",Rosé
1392,Finca La Luz,Argentina,88,"Raspberry and plum aromas start with a resiny oak covering that turns foresty and briary with airing. This is raisiny and ripe in feel, with a complex mix of berry, fennel and anise flavors. A lush, dense-feeling finish is minty and herbal.",Callejon del Crimen Gran Reserva
1393,Foppiano,US,88,"This tastes of warmer Russian River Valley climes, darker and riper in black cherry and berry fruit character with a layering of toasty cinnamon and oak. The aroma tends to the earthy/pastoral.",Estate Bottled
1394,Kramer,US,88,"As is often the case with Oregon's 2011 Pinots, this remains stubbornly tight, and shows herbal and stem flavors rather than pretty fruit. That said, it also displays the excellent structure of the better wines from the vintage. Underpinnings of acid and tannin, plus the still sharp-edged pomegranate fruit, may carry it up to 2024.",Heritage
1395,Le Cadeau,US,88,"This comes from estate-grown fruit in the Chehalem Mountains AVA. Spicy and sharp-toned, it brings tart acidity and highlights of orange peel to flavors of wild mountain berries. The tannins are still a bit rough, but should smooth out with more bottle age.",Rocheux
1396,Les Vignerons des Terroirs de la Noëlle,France,88,"It's the hard, granite rock of the vineyards that gives this wine its tight, firm texture. It is very crisp, structured with tense acidity and strong lemon-lime flavors. The wine, with its intense freshness, is very much made to partner food.",Domaine de Bégrolles Sur Lie
1397,MacMurray Estate Vineyards,US,88,"A new label for MacMurray Ranch, this Pinot Gris is stony in fresh nectarine, pear and mango, wrapped in a creamy texture that develops fleshy flavors of fig in the glass. The fruit is sourced from both MacMurray Ranch and Gallo's cooler Russian River Valley outpost, Two Rock, near Petaluma.",
1398,Miro,US,88,"This wine offers a lighter side of Petite Sirah. It conveys more red fruit than brooding black and blue, a taste of red licorice and lean, balanced red cherries sleekly layered over earthy plum and spice. Its structure and acidity make it food-friendly, ready to accent a black pepper steak or similarly seasoned roast.",
1399,Ca' del Baio,Italy,88,"Exotic incense, sandalwood and ripe berry aromas waft from the glass of this single-vineyard Barbaresco. The palate is initially closed but slowly reveals crunchy Morello cherry, toast and espresso alongside assertive tannins. Drink after 2018.",Asili
1400,Los Dos,Spain,88,"Pure berry aromas define the nose on this highly drinkable Garnacha-Syrah blend. In the mouth, it's clean, juicy, a bit round and easy to process. Typical Aragónese flavors of plum and berry finish tasty and unbroken.",
1401,Luna Beberide,Spain,88,"This respected Bierzo producer's base-level Mencía is jumpy on the nose, with floral berry and plum aromas. It feels fresh and bright, with ample structure. Standard berry, plum and currant flavors come with notes of spice, while the finish is forward and fresh.",
1402,Materra Cunat Family Vineyards,US,88,"Floral and pretty in ripe peach and pineapple/mango, it unwinds with a finish of vanilla.",Estate Grown
1403,Maysara,US,88,"Finished (apparently) off-dry, this seems to show some residual sugar in a leesy, yeasty style. The fruit suggests pears and cotton candy, with juicy acidity supporting the sweetness. Don't look for your standard dry Pinot Gris, but what's here is generous and enjoyable.",Momtazi Vineyard
1404,MCV,US,88,"This Petite Sirah-led blend offers cherry, cedar and smoke, with a bit of morel mushroom funk on the nose. The palate reveals tobacco, plum jam and harder-than-expected tannins, with a slight vanilla finish.",
1405,Navarro,US,88,"This is a smooth, easy-drinking and rather light-bodied wine, not unusual in the tricky vintage of 2011. Relatively light in color, this offers scents of sweet cherry, vanilla and cinnamon, while the flavors recall cherry and raspberry. The texture is almost delicate but livened up with a good touch of acidity.",
1406,Ochoa,Spain,88,"Varietally specific aromas of wild flowers, honey and lemon verbena set up an unctuous, creamy palate with modest acidity and lots of weight. Honey, mango, vanilla and other sweet, tropical flavors finish thick but not quite cloying. This is a unique wine for Navarra that deserves to be judged on its own.",Vendimia Tardia Single Vineyard Finca El Bosque
1407,Reverdito,Italy,88,"Plum, vanilla, chocolate and subtle oak aromas carry over to the palate. The palate displays chocolate-covered cherries, fig and coffee alongside bracing tannins that leave a drying finish. Drink 2018–2025.",Castagni
1408,Silvan Ridge,US,88,"This is aggressively tart and herbal, but shows good density and concentration. Flavors of lemon verbena mixed with lime-ade run true and full on through an extended, focused finish.",
1409,Stemmler,US,88,"Pastoral and earthy, it's straightforward and tightly woven in tannins, with balanced acidity that offers a sense of wild strawberries. A well-made wine priced attractively; stock up for midweek needs.",
1410,Cottanera,Italy,90,"Aromas of citrus, white stone fruit and a vegetal hint suggesting tomato leaf lead the way. The racy palate offers grapefruit, pineapple, fresh white peach and flinty mineral while a pleasantly bitter note closes the finish.",Bianco
1411,Carabella,US,90,"Fresh fruit flavors suggest a bowl full of berries and cherries. Crisp acids help to focus the wine, with spot-on varietal flavors and balance. Both elegant and complex, it's a lovely bottle from an under-the-radar producer.",Estate
1412,Chateau Dereszla,Hungary,90,"This delicate Hungarian white wine is a blend of 86% Furmint, 9% Yellow Muscat and 5% Kabar. It has enticing aromas of white flowers, botrytis, gardenia, apple blossom and apricot that prepare your palate for flavors of peach juice, citrus zest, grapefruit juice, caramelized pineapple and a crisp clean finish.",Dry
1413,Easton,US,90,"In a classic combination of ripe flavors and lip-smacking structure, this full-bodied wine wraps concentrated black cherry and mint aromas and generous cherry and blackberry flavors in muscular tannins that keep the texture fresh.",Estate Bottled
1414,Fess Parker,US,90,"Tar and beef char kick off the nose on this dark and heavy wine, which offers asphalt, smoked meats and crushed elderberry. Caramelized beef, balsamic-blackberry reduction, tobacco and touches of smoke show on the palate.",
1415,Feudi di San Gregorio,Italy,90,"Aromas of pear, Spanish broom, flint and Mediterranean herb emerge in the glass. The juicy, medium-bodied palate offers ripe apple, peach and lime alongside fresh acidity and a mineral vein. A hazelnut note marks the close.",
1416,Andrew Murray,US,90,"The man who makes a million Syrahs dives into a blend of 60% Grenache, 25% Mourvèdre and 15% Syrah on this bottling, which offers composting lilac, black pepper, fresh boysenberry, dried herb and a tarry quality on the nose. There's a strong blackberry-balsamic reduction flavor once sipped, as well as beef char, elderberry and more tar.",Esperance Curtis Vineyard
1417,Argyros,Greece,90,"Pineapple and lime peel start the nose of this layered Assyrtiko. On the palate, it unfolds with a combination of lemon peel, grapefruit and sea salt. This wine can age for several years but is good to drink now; pair with lamb, fresh fish or Asian cuisine.",
1418,Lorenzi Estate,US,90,"Loads of clove, allspice, cinnamon and nutmeg spice show up the strawberry, blueberry and red cherry aromas of this lavish bottling, which also offers scents of crushed rock and turned earth. Similar elements entertain the palate, culminating with a minty pine needle note, proving to be a very dynamic sip.",Old Vine Lopez Ranch
1419,MacPhail,US,90,"Huckleberry and dark cherry mingle around a viscosity of velvety texture and tannin, dusted in notions of black tea, tar and red currant. Light in color, but bold in flavor, this wine speaks to both the cool nature of its vineyard site, and to the style of the winemaker.",Pratt Vineyard
1420,Herzog,US,90,"Smooth, medium-bodied layers of pomegranate, red currant and a refreshing sense of citrus make for a light, food friendly companion, especially with the wine's satisfying bite of acidity and lengthy finish.",Special Reserve
1421,Hunnicutt,US,90,The grapes for this full-bodied wine hail from the Luvisi Vineyard in the heart of Calistoga old-vine country—a warm and welcome site for the variety. Baked blackberry and black olive combine around a taste of charred meat before brawny spins of brown sugar and nutmeg play on the palate with jolts of chocolate and vanilla.,
1422,J Vineyards & Winery,US,90,"This is a creamy, thick and food friendly white with highlights of honey and green apple and a lingering decadence of ginger, just hinting at anise. Medium-bodied, it represents the vintage and the appellation well, at a price that's nice.",
1423,Kale,US,90,"A majority of Grenache and tiny bit of Mourvèdre from Kick Ranch and McGah Vineyard were racked to concrete egg for fermentation, with the intent of preserving freshness. Successful in that quest, this orange-pink wine is dry, tangy and well-integrated in terms of acidity, subtle in cranberry, dried cherry and orange, with a light, refreshing finish.",
1424,Leon Beyer,France,90,"The slightest notes of angelica and kiwi fruit lend perfume to a slender, almost weightless body. This slinky Sylvaner runs rings around you, intriguing with its weightless charm. It's dry, lithe and refreshing.",
1425,Tornatore,Italy,90,"Aromas of mature dark-skinned berry, fennel, toast and baking spice come together in the glass. The taut, focused, palate shows ripe black cherry, red raspberry, mineral and licorice while fresh acidity and firm tannins provide balance. Drink 2019 through 2024.",Trimarchisa
1426,Upper Five,US,90,"Spicy and lightly peppery, this fresh rosé brings concentrated strawberry fruit into focus. Made from organically grown grapes, it expands into a full-bodied finish with a lick of milk chocolate.",Rosé of
1427,Rainer Sauer,Germany,90,"A fresh green-floral touch persists throughout this refreshing dry Silvaner. Light-footed in style, it offers crisp green-plum flavor accented by zippy flashes of lime and lemon zest. The finish is invigorating and brisk.",Gutswein Trocken
1428,Raptor Ridge,US,90,"Here is the most engaging offering of the winery's 2013 single vineyard Pinots. It's bright with red-berry fruit and tropical-candy highlights. Meyer lemon peeks in, and the tangy fruit flavors continue into a finish of medium weight and length. Drink now and over the next couple of years.",Olenik Vineyard
1429,René Muré,France,90,"Grated lime zest on the nose leads to an uncompromisingly but refreshingly brisk palate. This has freshness and a stony, almost chalky depth and wonderful concentration and freshness. It's dry, brisk and invigorating.",Signature
1430,Soléna,US,90,"A bit stiff, this expresses its terroir with accents of earth and clay around muted red fruits. Streaks of sassafras, coconut and vanilla emerge as the wine breathes open. Decant this one for at least an hour or two.",Zena Crown Vineyard
1431,Spangler,US,90,"This is a real tongue-stainer, earthy and packed with purple fruits. Flavors of blueberries, plums, bitter chocolate and charred wood abound. The wine remains lively with ample acidity and smooth, though dense tannins.",
1432,Napa Cellars,US,90,"This well-made wine blends in a hearty 17% Petite Sirah, providing additional power and dusty berry flavor. Sultry and velvety on the palate, it's spicy and peppery in subtle measure, with a juicy cheeriness on the lengthy finish.",Classic Collection
1433,Paraduxx,US,90,"A new offering made entirely from estate fruit, this is a selection of the best blocks and barrels of the vintage, with its core component being 90% Howell Mountain Cabernet Sauvignon. The remainder is Zinfandel. Together they provide black color and a whiff of bay leaf and peppercorn, around well-integrated layers of black cherry, vanilla and black tea.",X2 Estate
1434,Peter Franus,US,90,"Peppery leather opens up this wine, blended with 5% Mourvèdre. More savory than fruity, it pleases in big tannin weight and length, with an intensity of brambly wildness and a sagey, smoky edge.",
1435,Marqués de Vargas,Spain,90,"Typical for this winery, this smells a bit herbal, with tomato and earthy plum aromas leading the way. Scratchy, grabby tannins support savory, herbal berry flavors. Hard tannins struggle to resolve themselves on a firm, muscular finish.",Reserva
1436,Remelluri,Spain,90,"This is a ripe, earthy, modern-leaning Rioja with aromas of blackberry, raisin and rubber. Soft and fleshy on the palate, what this easygoing number lacks in structure is made up for in charm. Ultraripe flavors of plum and berry come with a chocolaty accent, while the finish is smooth and tastes earthy and spicy. Drink through 2019.",Lindes de San Vincente
1437,Steele,US,90,"Brilliant, pure fruit flavors light up this full-bodied but easy-to-drink wine. Cherry, strawberry and something deeper like black currant dance through the aromas and coat the tongue with their richness. The texture is smooth and plush due to fine tannins and mild acidity.",DuPratt Vineyard Old Vine
1438,Weinreich,Germany,90,"Dark shades of bramble and smoked nuts lend a shadowy mystique to this unusual Schwartzriesling, otherwise known as Pinot Meunier. Full bodied yet elegant, the palate boasts tart blackberry and raspberry flavors framed in finely grained tannins. A rare chance to experience this grape as a single varietal wine.",Bechtheimer Trocken
1439,Contino,Spain,90,"Earthy berry and raisin aromas announce a warm, ripe wine. This feels plump, grapy and chunky, with moderate acidity. Grapy, bold flavors of raspberry, prune and cherry are earthy and loamy, while ripeness and a raisiny element carry onto the finish. Drink through 2019.",
1440,Büyülübağ,,90,"A blend of 60% Syrah, 30% Cabernet Sauvignon and 10% Merlot, this inky garnet-colored wine offers aromas of cassis and elderberry. On the palate, there is a combination of cooked fruit and cool spice flavors yet there is no lack of accompanying acidity. Flavors of cassis, elderberry, anise, orange peel and vanilla are backed by silky tannins that stay smooth into the cooling finish.",Shah
1441,Carpineto,Italy,90,"Scorched earth, cured meat, toasted nut and grilled herb aromas lead the nose on this full-bodied red. The warm, ripe palate doles out raspberry jam, mature black cherry, vanilla and star anise framed in firm, velvety tannins.",
1442,Charles Smith,US,90,"The aromas of herbs, pencil lead and blue and red fruit are forward, fresh and appealing. The flavors follow similarly, showing depth and balance uncommon for a wine this price.",Velvet Devil
1443,Château de Santenay,France,90,"The picturesque name of the wine, the vineyard where God sits, comes from a monopole—a walled property in the hills behind Beaune, wholly owned by the Château de Santenay. Ripe and smooth with an attractive, crisp texture, the wine is ready to drink. A touch of toast gives extra interest.",Clos de la Chaise Dieu
1444,Cordella,Italy,90,"Tilled soil, forest floor, mature black-skinned fruit, leather and a truffle note come together in the glass. The firmly structured palate presents juicy black cherry, crushed raspberry, cinnamon, vanilla and an earthy hint of game while assertive, close-grained tannins provide support. Give it a few years for the tannins to relax then enjoy. Drink 2019–2023.",
1445,Davis Family,US,90,"A majority of Grenache plays lead here, with an accompaniment of 35% Syrah and 12% Mourvedre. Concentrated in a grip of leather, there's further integration of earth and black fruit that stays bright and vibrant on the palate, a medium-bodied coming-together of savory with ripe.",Throne
1446,Domaine Chavet,France,90,"Produced from 25-year-old vines, this is a fresh as well as ripe wine, well balanced between herbal flavors and white and citrus fruitiness. It has a rounded texture that is juicy as well as full in the mouth. The wine is ready to drink.",
1447,Sparkling Pointe,US,90,"Complexities of mushroom, caramel and brioche lend a haze of maturity over delicate strawberry and cherry notes in this Champagne-style sparkling,which was aged for eight years over lees. Tiny, persistent bubbles spread seamlessly on the palate, accentuated by streaks of racy acidity.",Brut Séduction
1448,Stolpman,US,90,"Always an eye-opening bottling, this blends 50% Sangiovese with 50% Syrah. This vintage shows cooked blackberries, baked plums, balsamic vinaigrette and black rocks on the nose. The palate is juicy and energetic, blending dark fruit with bright acidity, coffee and caramel flavors, with strong tannins for structure.",La Croce
1449,Bailiwick,US,90,"Buy this for its balance and welcome sense of restraint that gives way to richness on the finish. Crisp apple and light citrus aromas, then nicely concentrated and similar flavors, put an attractive spin on this medium-bodied, fresh and appealing wine.",
1450,Domaine des Baumard,France,90,"What Baumard describes as a “secret blend” from its vineyards, this wine is both sweet and fresh. Honey and intense acidity are filled out with baked apple and lemon-marmalade flavors. It is ready to drink in all its fresh glory.",Le Petit Paon
1451,E. Guigal,France,90,"Guigal does a terrific job with its regional wines, and this rosé is no exception. Notes of crushed stone and underripe pineapple broaden out into red berries and white chocolate on the weighty but balanced palate.",
1452,Freeman,US,90,"Layered aromas and rich but vibrant flavors help this medium-bodied wine stand out. It has a medium color with a brickish rim, while aromas suggest black tea and black cherry. A dry, tangy, but ripe fruit expression on the tongue lingers on the finish.",
1453,Huerta de Albalá,Spain,90,"Aromas of earthy, nutty, mature berry fruits come with a hint of raisin and a touch of compost. This saturated Vino de Cádiz is composed of 80% Syrah, with Merlot and Cabernet Sauvignon. It's a heavy wine with flavors of vanilla, burnt wood, blackened spices and stewed berries. The finish tastes peppery, dark and outright woody. Drink through 2019.",Taberner No1
1454,Huerta de Albalá,Spain,90,"This blend from Cádiz features Syrah, Merlot and Cabernet Sauvignon. It's big, ripe and minty on the nose, with hints of animal fur and leather. A blocky, full palate weighs in at 15.5%, while flavors of oak and vanilla blend well with spiced berry fruit. A drying finish tastes mostly of oak. Drink through 2025.",Taberner
1455,Kunde,US,90,"From older vines on the producer's estate, this wine has a depth of richness to the nose and is intensely powerful in gingerbread and Meyer lemon on the medium-bodied palate. Lemony acidity rounds out the finish, flecked in butter.",Reserve
1456,La Voix,US,90,"There is much buzz about this new Steve and Chrystal Clifton (of Palmina and Brewer-Clifton) project that finds inspiration for wine from music. This orange-mauve-pink rosé is redolent with the familiar Pinot components of cherry, sagebrush and clove. On the palate, iron, graphite and wild herbs spice up the pomegranate fruit. It's very varietally pure.",She's Crafty Rosé of
1457,Martin Ray,US,90,"This is a brawny, strongly powerful wine, fully displaying the grip of mountain fruit. Blackberry and black currant complement the tobacco and cedar. Drink now through 2023.",
1458,Martin Ray,US,90,"This 100% varietal wine offers plenty of crisp cranberry, currant and restrained red fruit on the palate, the texture soft and supple. A pleasing shock of dark chocolate appears on the finish.",Simpson Ridge
1459,Oakville East,US,90,"Leather and peppercorn jump from the glass in this soft, strong wine, powerful in tannin and dusty earth. A gravelly, rocky component plays on the palate around waves of chocolate and black currant, finishing in herb.",Franc 'n Stern
1460,Quivira,US,90,"A blend of 60% Montepulciano and 40% Sangiovese, this is a grippy, leathery wine, the fruit sourced from two different sites in the appellation. Black leather, baked and dried plum, and cherry combine on the palate with breadth and length, finishing as if dusted in cocoa.",Montepulciano-Sangiovese
1461,Castello della Paneretta,Italy,90,"Red berry, chopped herb, blue flower and menthol all come together on this elegantly structured red. The juicy, accessible palate offers ripe black cherry, crushed raspberry, licorice and a hint of vanilla alongside round tannins. Drink through 2021.",Riserva
1462,Edetària,Spain,90,"Smoky, oaky, rubbery aromas are sophisticated and inviting. This blend of 90% Garnacha and 10% Carignan feels smooth, but with a healthy pulse. Plum and cherry flavors carry a note of oaky char, while a long, toasty finish offers a complex note of cured meat. Drink through 2020.",Selecció
1463,Frog's Leap,US,90,"From the heart of the Rutherford Bench, this estate-grown wine is a classic version of restraint and elegance, structured in dusty tannin with bursts of cedar, tomato leaf and cassis. Cabernet Franc makes up 8% of the blend, with 3% Merlot. This will benefit from time in the cellar; drink 2020–2023.",Estate Grown
1464,Hirsch,US,90,"Complex and well balanced, this wine shows enticing aromas of fruits, spices and subtle herbs followed by tangy, dry, and slightly lean flavors like cranberry and rhubarb. It will be great with a roast fowl of some kind and should mellow more with time. Best after 2018.",Estate Reserve
1465,Keenan,US,90,"Decadent and candied, this is an oaky, well-made wine with richness at its core. Tahitian vanilla, caramel and Meyer lemon give way to more weighty tropical characteristics, making for a ripe, bigger-styled wine.",
1466,Lavau,France,90,"This mid-sized négociant has turned out a solid Tavel. It's classic red-berry hue is typical for the appellation, followed by ample weight on the palate and bold cherry-berry flavors—all wrapped up by a long, mouthwatering finish.",
1467,Marianello,US,90,"This ambitious blend of 60% Sangiovese, 15% Merlot, 15% Petite Sirah and 10% Cabernet Sauvignon largely succeeds, with aromas of tight blueberries, concentrated purple flowers and a touch of crushed peppercorn. The fruit-driven palate is dense with blueberry, tart boysenberry and a dusting of cocoa.",Cielo Rubio
1468,Michael David,US,90,"This wine is a big one, going all out to make friends. New-oak aromas like clove, cedar and cinnamon explode out of the glass, then flavors of dark chocolate and cherry spread across the palate for a generous—almost thick—impression. Fine layers of tannins and firm acidity blanket the texture.",6th Sense
1469,Oremus,Hungary,90,"This late harvest wine reminds one of lemon grass, cut grass and honeysuckle. It is sweet with a good acid balance along with flavors of lemon meringue pie and lemon curd.",Late Harvest
1470,Argyle,US,90,"Clean, crisp and bright, this was fermented in stainless (with just 10% in neutral wood), and not put through malolactic. The blend is 60/40 Chardonnay/Pinot Noir, yielding fresh fruit flavors of apple and melon that are focused and precise. A streak of ginger runs through racy acidity.",Vintage Brut
1471,Argyle,US,90,"Firm and focused, this lightly spiced effort supports its tart cherry fruit with ample acidity. Hints of toasted coconut build in the finish. A few more years of bottle age should bring further integration.",Nuthouse Lone Star Vineyard
1472,Big Table Farm,US,90,"A striking shade of amber/orange, this soft and fruity wine is open and loose knit, with broad flavors of mature, slightly oxidized tree fruits, plus lightly spicy notes of cinnamon and baking spices. It's very well made, but well apart from any standard approach.",Wirtz Vineyard
