Unnamed: 0,winery,country,points,description,designation
941,Fenestra,US,89,"This medium-bodied wine is fresh and fruity, but also polished and sophisticated. It smells like raspberries and black plums, then adds chocolate and blackberry in the flavors. Rich and flavorful it also has welcome firm tannins and fruit acidity to keep it lively. Grenache is the leading grape ingredient.",Estate Infrared
942,Franz Keller,Germany,89,"Wildflower and lemon zest brighten this dry, citrusy Pinot Gris. Lip smacking white grapefruit flavors flood the palate, along with a hint of bitter almond. It's a revitalizing white that's ready to drink, but also likely to maintain its fresh, primary flavors through 2017.",Schwarzer Adler
943,Maray,Chile,89,"This blend is mostly Syrah, with Merlot and Cabernet Sauvignon backing it up. Dense, earthy, meaty and lightly roasted on the nose, the palate is mildly tannic, with lively acidity. Roasted, foresty plum and red-berry flavors end short and baked in character.",
944,Nino Negri,Italy,89,"Vibrant and elegant, this delivers aromas and flavors of crushed red cherry, raspberry, cinnamon-spice and Alpine herbs. Supple tannins and bright acidity provide support. Enjoy through 2018.",Inferno
945,Laetitia,US,89,"Quite foamy when poured, this bubbly from the historic sparkling house offers aromas of apple flesh, ripe pears and lemon-lime soda. It presents straightforward flavors on the palate accented with apple blossoms, while white tuberose florals and a touch of guava trend toward the tropical side of the scale.",Brut Cuvée
946,Leopoldo I di Toscana,Italy,89,"Aromas of ripe dark-skinned fruit, spice, underbrush and dried herbs emerge from this blend of Cabernet Franc, Merlot and Petit Verdot. The palate delivers dried black cherries, plum, clove and grilled sage alongside tightly-knit tannins. Drink 2016–2020.",D'Aria
947,Lumos,US,89,"Spicy and still tight, this shows a big-boned style. Penetrating pear fruit flavors are dotted with white pepper, and finished with a hint of water cracker.",Logsdon Ridge Vineyard Rudolfo
948,Maquis,Chile,89,"Dense aromas of earth, berry fruits, latex and animal fur are a touch challenging at first but balance out with airing. This has a crisp, fresh feel despite coming from a hot year. Lightly herbal, leathery flavors of red currant and wild berry finish oaky, with more than adequate filling.",
949,Petra,Italy,89,"Subdued aromas of espresso, tobacco, cedar, tilled soil and mature black fruit waft out of the glass. Made entirely with Cabernet Sauvignon, the elegant palate offers raw red currants, dried black cherries, clove and anise alongside silky but rather fleeting tannins.",Potenti
950,Quinta das Carvalhas,Portugal,89,"Old vines of Tinta Francisca have produced a generous, full and concentrated wine. It is packed with forward berry fruits and as well as soft tannins that are finely integrated. The end is fresh, and always fruity.",Carvalhas
951,Rocca delle Macìe,Italy,89,"Made from Sangiovese blended with 20% Cabernet Sauvignon and Merlot, this opens with aromas of sawdust, oak, exotic spice and a whiff of black currant. The palate displays toasted oak, roasted coffee beans, menthol, ground black pepper and dried black cherries alongside grippy tannins that leave an astringent finish.",Ser Gioveto
952,Stoller,US,89,"Fresh strawberry fruit with a bit of spice makes this an easy choice for warm-weather sipping. Tart, with lemony acidity, it's young and lively. Good as it is on its own, it would make an awesome punch.",Pinot Noir
953,Tamber Bey,US,89,"Offered in a half-bottle size, this estate Cab-based wine also contains 6% Merlot and 6% Petit Verdot. The blend is crisp, dry and tannic in cranberry, barely ripe cherry and dried currant, swerving savory into dried herb and clove.",Oakville Estate
954,Tenuta di Trinoro,Italy,89,"Dense and concentrated, this blend of 66% Cabernet Sauvignon, 26% Cabernet Franc and 8% Petit Verdot initially has a subdued nose that eventually reveals prune, alcohol, tobacco and leather aromas. The syrupy palate doles out blackberry extract, fig, sweet spice and soaring alcohol alongside velvety tannins. While some may like the sheer power, the dominant alcohol stunts any complexity, giving it a monolithic quality.",
955,Tenuta Sette Ponti,Italy,89,"Firm and spicy, this blend of Sangiovese and 10% Merlot opens with aromas of black plum, crushed violet and kitchen spices. The juicy palate delivers ripe black cherry, licorice and clove alongside a backbone of tightly wound but refined tannins. Drink 2016–2020.",Crognolo
956,Walnut City WineWorks,US,89,"The vineyard is in the Eola-Amity Hills AVA, though the label does not indicate it. There is a welcome purity to the fruit expression, pretty cherry flavors with a suggestion of hard candy. Although it has light herb and stem highlights, nothing overshadows the lovely fruit.",Z'ivo Vineyard Reserve
957,Wines & Winemakers,Portugal,89,"A blend of Touriga Nacional and Touriga Franca, this dark-colored, serious wine is concentrated and structured. It offers black fruits, giving a brooding character that's full of power. The aftertaste with its acidity and juicy fruit is elevated and leaves with a lift.",Andreza
958,YNOT,US,89,"Aside from hints of dark wild raspberries, this entry-level, second-label wine by Norm Yost doesn't offer overt fruit on the nose, instead showing graphite, dark earth and crushed rocks. Earthy flavors of beet juice and juniper show a slightly sour side, making for an interesting wine, if not completely delicious",
959,Zacharias,Greece,89,"This exotic white blend starts with citrus and floral aromas and offers a palate of soft lemon curd, orange and white fruit. Rich but with a cutting finish, it's a good food wine for bigger seafood flavors.",Ambelos Phos Roditis-Moschofilero
960,Negro Angelo e Figli,Italy,90,"Mature berry, underbrush, leather, fennel and a whiff of grilled herb meld together in the glass. The firm, vibrant palate shows ripe wild cherry, black raspberry, licorice, coffee and a balsamic note while bracing, fine-grained tannins provide the framework. Give this a few years to come together. Drink after 2020.",San Bernardo Riserva
961,Obsidian,US,90,"Smooth and appealing, with a smoky edge to the purple plum and berry fruits, this is a flavorful, forward and easy-drinking rendition of what may become Southern Oregon's signature grape. The tannins are silky and the length impressive.",
962,Poças,Portugal,90,"From grapes grown in the Douro Superior region, this is an open delicious fruity and ripe wine that is ready to drink. Its black currant and red berry tastes are balanced by spice, wood aged flavors and a core of tannins. The aftertaste introduces fresh juicy acidity.",Vale de Cavalos
963,Ray's Station Vineyards,US,90,"Ripe fruit flavors and a delicious spiciness combine to make this full-bodied but not very tannic wine easy to love. It smells like cherries and raspberries, tastes full but not sweet, and has a texture that spreads and softens on the palate like melting chocolate. It's made with 50% Zinfandel and almost equal parts Syrah, Carignane and Petite Sirah.",Coro Mendocino
964,Rioja Vega,Spain,90,"Resiny oak and mildly stalky berry aromas muscle out cherry and raspberry scents. This feels grabby and clampy, while oaky flavors of mixed berries and baked plum end with coconut-infused oak flavors and notes of raisin and licorice. Drink through 2020.",Reserva
965,Rivetto,Italy,90,"Aromas of mature black-skinned fruit, blue flower and Oriental spice float out of the glass. The round, full-bodied palate offers dried black cherry, blackberry jam, licorice and pipe tobacco alongside chewy tannins.",Zio Nando
966,Segal's,Israel,90,"This wine is dark red-violet color to the eye, offering aromas of blackberry, roasted red pepper and juniper berry. It is very smooth on the palate, with flavors of black plum, blackberry, white peach, elderberry and violet. There is a slightly dominant eucalyptus flavor that backs off at the finish, replaced by a fresh cherry juice flavor.",Special Reserve
967,Small Vines,US,90,"Wild strawberry and a thicket of dense tannin belie a powerfully strong and elusive wine, still very much tightly wound, indicative of the vintage. A portion (35%) of the grapes were whole-cluster pressed, from tight-spaced, low-yielding vines. A little more oak was used than in most of the producer's other wines, helping to impart a spicy finish.",MK Vineyard
968,St. Urbans-Hof,Germany,90,Fresh apple and pear flavors are swathed in fresh herbs and citrus peels in this bristling medium-sweet wine. It's lusciously honeyed but finishes long with honed steely precision.,Bockstein Ockfen Auslese Erste Lage
969,Stemmler,US,90,"Raisin and white pepper aromas, ripe fruit, floral and spicy anise flavors and full body add up to a big wine in which the whole-cluster fermentation method can be tasted. The hearty flavors, complexity and firm tannins paint a unique picture, and this bottling makes a dramatic contrast in style from the “regular” Anderson Valley Pinot Noir.",Whole Cluster
970,Tabor,Israel,90,"Dark garnet in the glass, this wine has a nose of strawberry, black plum, caramel and smoked meat. It offers a good balance of acidity and tannins, with flavors of blackberry, blueberry, smoked meat, vanilla and mocha. The vanilla flavor is extended on the palate thanks to lingering silky tannins that eventually dissolve in a note of orange zest.",Mt. Tabor
971,Tenuta Duecorti,Italy,90,"Blue flower, mature plum, licorice, clove, mocha and menthol aromas all come together on this brawny red. The warm, bold palate delivers juicy black cherry, espresso, ground pepper and anisette alongside a backbone of fine-grained tannins. Showing the heat of the vintage, it won't need years to come around. Drink 2018–2028.",Castelletto
972,Terras de Alter,Portugal,90,"This concentrated wine was wood aged for six months, giving the lightest touch of oak along with ripe yellow fruits and a crisp tangy aftertaste. It has a touch of spice along with bright acidity at the end. Drink now.",Terra d'Alter Reserva Branco
973,Thomas George,US,90,"A blend of three estate-farmed vineyards, this is a velvety-smooth expression of the variety. It conveys a touch more richness and concentration than some of the producer's other wines, at least at the beginning of the glass, when almond and hazelnut rule the day. But then it takes on a lightness toward the lengthy finish, ending in a mix of lemon zest and apple.",Estate
974,Tulip Winery,Israel,90,"This wine features a bouquet of cherry, pomegranate and freshly ground black pepper. It is well-balanced on the palate with flavors of pomegranate, strawberry, mace and anise. Smooth tannins are present into the bright yet lasting finish.",Espero
975,Wedell Cellars,US,90,"The nose on this appellation blend is full of soft tones of ripe nectarine and pluot, though cut with walnut oil and a citrus edge. It's more pithy in flavor, showing orange bitters, dried apples and more nut oils, slightly oxidative in style.",
976,Winderlea,US,90,"Planted in 1988, this vineyard 's fruit captures the unique minerality found in this AVA. It leaves an impression of sucking on rock—not a bad thing in a wine. The black-cherry fruit grips the palate with real power and some density, with potent herbal highlights as well. Drink this now through the mid-2020s.",Meredith Mitchell Vineyard
977,Yatir,Israel,90,"Dark black cherry in color, this wine offers a bouquet of cherry preserves, matchstick and petrol. It is far livelier on the palate than on the nose, featuring flavors of cherry, pomegranate and bell pepper with a light touch of florality. Chewy tannins make their way across the gum and tongues and are all but erased by a final note of orange zest and cranberry.",
978,Cascina Luisin,Italy,90,"Dark berry, mocha, toast and cooking spice aromas emerge in the glass. The taut palate offers mature black cherry, coffee and dried herb alongside assertive, fine-grained tannins.",Leon
979,Azari,US,90,"Cherry-berry and vanilla surround a soft, spicy core of high-toned red fruit. Mellowed with age, the tannins linger in perceived sweetness.",
980,Borgogno Giacomo e Figli,Italy,90,"Red rose, bright berry and anisette aromas lead the way. The taut palate offers sour cherry, tobacco, clove and chopped herb alongside bracing tannins and brisk acidity.",Cannubi
981,Ca'Romè,Italy,90,"This brawny, forward wine opens with aromas that recall spirits, steeped plum, roasted coffee bean and menthol. The dense, chewy palate offers black cherry liqueur, licorice, espresso and the warmth of evident alcohol accompanied by brooding tannins. Drink sooner rather than later.",Rapet
982,Ceretto,Italy,90,"Aromas of rose, red berry, espresso, grilled herb and toast lead the nose. The taut palate offers crunchy red cherry, raspberry, star anise and white pepper alongside tightly wound, assertive tannins. It closes on a note of roasted coffee bean.",Bernardot
983,Luigi Pira,Italy,90,"Earthy aromas of leather, game, sunbaked earth and mature dark-skinned berry take center stage. The tense palate offers dried black cherry, mocha, espresso licorice and tobacco alongside fresh acidity and close-grained tannins.",Margheria
984,Reverdito,Italy,90,"Mature dark berry, crushed blue flower, spice and peppermint aromas lead the nose on this structured red. The firm palate offers ripe black cherry, white pepper, cocoa, star anise and a balsamic note accompanied by bracing tannins. Drink 2018–2016.",Ascheri
985,Valdubón,Spain,90,"Cherry and plum aromas are accented by buttery oak, leather and animal notes. Solid in feel with firm tannins, this warm-vintage Tempranillo is ripe, loamy and loaded with berry and cassis flavors. A lightly raisiny finish is friendly and round. Drink through 2019.",Reserva
986,Vietti,Italy,90,"Aromas of wild berry, dark spice, menthol and a hint of pressed flower lead the way on this straightforward Barolo. The full-bodied palate offers dark cherry, licorice and dried herb alongside firm, ripe tannins. Drink 2018–2026.",Castiglione
987,Dalrymple,Australia,90,"This is strongly marked by new oak on the nose at this stage, suggesting toast, brown sugar and coffee, but fruit comes through on the palate where hints of dark berries, cola, clove and cinnamon mingle. The wine is creamy and lush in texture, with ample weight and a lingering finish of dried fruit, vanilla and mocha. Drink from 2018 to 2025.",Coal River Valley Single Site
988,Antiquum Farm,US,90,"One of the most beautiful package designs in the state introduces a fresh and toasty wine that translates this cool, wet vintage into a most delicate and enjoyable bottle of Pinot. Light cranberry and cherry fruit is set in a gently proportional bed of tart acid and pretty oak, 40% new.",Juel
989,Argyle,US,90,"Clean, crisp and bright, this was fermented in stainless (with just 10% in neutral wood), and not put through malolactic. The blend is 60/40 Chardonnay/Pinot Noir, yielding fresh fruit flavors of apple and melon that are focused and precise. A streak of ginger runs through racy acidity.",Vintage Brut
990,Marcello Turra,Italy,85,Aromas of mature yellow apple and a whiff of chamomile flower lead the nose. The aromas carry over to the extremely ripe palate along with a hint of acacia and a marked note of bitter almond.,
991,Auspicion,US,85,"Smoky, toasted oak aromas lead to strong char and butter flavors and a viscous texture that clings to the palate. Subtlety is not one of this wine's virtues, as its outsized flavors stand in stark relief.",
992,Carmel,Israel,85,"A clean nose of citrus paves the way for flavors of grapefruit and Sevilla orange. This wine is soft and pleasing on the palate, but it may be touch tart for some tastes.",Admon Vineyard
993,Caves Campelo,Portugal,85,"With its typical prickle on the tongue, this is a medium sweet wine. It's clean, crisp and citrusy, with sliced apple and orange zest flavors. Drink now.",Campelo
994,Caves Campelo,Portugal,85,"Lightly spritzy, this tastes of crisp apple and finishes just off-dry. It's deliciously refreshing, bright and tangy. Drink now.",Miranda
995,Adega Cooperativa do Cartaxo,Portugal,85,"This is a dry sparkling wine with tannins, spice and berry fruit, giving it a deep color. Not an apéritif wine, it's perfect for cutting through rich, oily foods. Drink now.",Plexus Tinto
996,Adega de Cantanhede,Portugal,85,"This is a soft, creamy wine with fruitiness and a yeasty edge. Made from Bical, Arinto and Maria Gomes, it's ready to drink.",Blanc de Blancs Bruto
997,Domaine de l'Herré,France,85,"This is a soft wine whose herbal character is held in check by a smooth texture. It is bright and crisp, with plenty of citrus and gooseberry flavors as well as intense acidity. The wine is ready to drink.",La Galope
998,Domaine du Touja,France,85,This white wine is fruity and crisp with a deliciously refreshing herbal edge. Lemon and pink grapefruit are cut by some zingy acidity and finished with a bright aftertaste. Drink now.,
999,Proemio,Argentina,85,"Dusty plum and berry aromas are clean. In the mouth, this is hard and wiry. Salty snappy plum flavors dry out and taste a bit like tin on a raw finish.",
1000,Quinta da Lapa,Portugal,85,"This yeasty wine is bone-dry, mature and ready to drink, a toasty element having replaced any fruitiness. The aftertaste is crisp and bright.",Brut Nature Reserva Arinto
1001,Vin Vault,US,85,"Buttery aromas and buttery, spicy flavors lend an outgoing personality to this medium-bodied wine. Vanilla and cream flavors add some interest, while the texture is broad and smooth.",
1002,The Naked Grape,US,85,A soft mouthfeel and fresh golden delicious apple flavors make this light-bodied wine easy on the palate. It has crisp and clean flavors all the way through.,
1003,Global Wines,Portugal,85,"With hints of minerality typical of any wine from the Dão, this has tight, yeasty notes that contrast with its crisp, bright apple fruit. Drink now.",Cabriz Bruto
1004,Global Wines,Portugal,85,"This wine balances swathes of ripe berry fruit with hints of tannin. It's fruity, full bodied and delicious to drink now. A great barbecue wine.",Cal Monte da Cal
1005,Global Wines,Portugal,85,"This is a classic style of Bairrada sparkling wine—a blend of Bical, Maria Gomes and Arinto. Plenty of crisp acidity and soft white fruit flavors balance its yeasty character. Drink now.",Encontro Q do E Blanco Bruto Classico
1006,Vergelegen,South Africa,85,"Surprisingly shy and reserved in nature, this offers subtle aromas and flavors of apple core and spiced orange peel. Soft and accessible, it's direct and clean, yet short on the finish. Drink now.",
1007,Bodega Renacer,Argentina,85,"A mix of blueberry, plum and animal aromas leads to a wiry, clipped palate fueled by tartaric acid. Lightly salted plum flavors are slightly jammy, while a blueberry note is brought back on the finish.",Punto Final MLB
1008,Essay,South Africa,85,"Bright aromas of tart apple, melon rind and fresh chrysanthemum dance in the bouquet, while the lively, lightweight palate offers notes of white peach and citrus pith. A subtle astringency graces the close. Drink now.",
1009,Ogier,France,85,"This is a plump, broad southern Rhône white, offering subtle notes of melon, pear and wet stones. Drink it before the end of 2017 while it still retains some freshness.",Héritages
1010,Charles Krug,US,85,"This dense, rich and ripe varietal Cabernet Sauvignon is aged in new French oak for 19 months. It shows smoked meat and bacon flavors that last into the finish.",Limited Release X Clones
1011,Noble Hill,South Africa,85,"Soft hints of peach, verbena and peony grace the delicate nose of this lightweight white. Touches of green banana and pear flesh out the palate, while ample acidity keeps the mouthfeel fresh through the finish. Drink now.",
1012,Château Clément Termes,France,85,This wine's blend symbolizes the Tarn's halfway position between the Atlantic and the Mediterranean. So it is has the perfumed Syrah and the more structured local Braucol to give a bright fruity wine with some touches of tannin as well as red-berry fruits. Drink now.,Les Petits Clément Syrah Braucol
1013,Domaine de Grange Neuve,France,85,A dry wine with a soft texture that suggests a small amount of residual sugar. It is a fruity wine with apricot and ripe pear flavors and a smooth aftertaste that still leaves plenty of room for acidity. Drink now.,La Fleur Lily Semi-Dry
1014,Domaine de l'Herré,France,85,"Produced in the west of Gascony, with a strong oceanic influence, this Chardonnay is cool, fruity and with bright acidity. It does have a creamy texture that fills out the fruitiness. It is an attractive, ripe wine that is ready to drink.",La Galope
1015,Herdade do Esporão,Portugal,85,"A wine for early drinking, this is soft, fruity and bright. With red berry flavor and gentle tannins, it's direct and packed with fruitiness. Drink now.",Pé Tinto
1016,Global Wines,Portugal,85,"A soft and easy wine with black currant fruit and gentle tannins, this has just enough acidity and structure to hold it together. Spice adds interest on the finish. Drink now.",Monte da Cal Colheita Seleccionada
1017,Pierre Gruber,France,85,This gentle blend of Aligoté and Chardonnay shows yellow fruit flavors. It has a crisp edge to its round smoothness. Drink now.,
1018,Thomas George,US,85,"From four estate vineyards, this wine appears to be low in oak and extra crisp in mouthfeel, offering austere apple and citrus elements with a slight metallic edge.",
1019,Tinazzi,Italy,85,This informal white opens with whiffs of orchard fruit and citrus while the simple palate offers suggestions of pear and pineapple. A hint of bitter almond marks the rather lean abrupt finish.,Cà de' Rocchi
1020,Weingut Georg Albrecht Schneider,Germany,91,"Pretty floral and apricot aromas brighten savory apple notes on this dry, but intensely honeyed Riesling. Bright and brisk on the palate, with searing lime acidity, it finishes long, with a refreshing spray of green herbs.",Niersteiner Hipping vom Rottligenden  Spätlese Trocken
1021,Anam Cara,US,91,"The Mark VI (similar to the above Heather's Vineyard) is a sort of reserve reserve, this one from barrels chosen to showcase the most cellar-worthy aspects of the vintage. It succeeds nicely, delivering a solid, firm, tart wine with young raspberry and cherry fruit at its center. The tannins have a lightly herbal, leafy streak, and there's little doubt this will benefit from additional years in the cellar.",Mark VI
1022,Vie di Romans,Italy,91,"This intriguing blend combines the structure of Chardonnay with the crushed tomato vine and cantaloupe aromatics of Sauvignon. The rich palate delivers a lovely depth of ripe apple, creamy lemon, and melon flavors, layered with hints of exotic fruit and spice.",Dut'Un
1023,Thistle,US,91,"A lovely, fresh, fruit-forward Pinot, it's flush with flavors of plums and cherries as it fills the palate. It gains power and mass with dark, slightly charred flavors of espresso wrapped into the finishing tannins.",
1024,Trenel Fils,France,91,"This solidly structured wine shows the firm tannins and mineral structure typical of wines from Côte du Py. It has dense black cherry fruits along with sacidity that cuts through the structure. It could age another year, but is worth drinking now.",Côte du Py
1025,Wines & Winemakers,Portugal,91,"This rich wine has a dense core of dark, dry tannins. The fruit, still taking its time to come through, is full of dark plum flavors and will soon show a fresher acidity. Wood aging, dark chocolate and a smoky character all bode well for the future. Drink from 2016.",Companhia daz Lezirias Reserva Tinto
1026,Wines & Winemakers,Portugal,91,"This rich, sophisticated wood-aged wine has complex fruits, structure and tannins. Ripe, juicy black fruits are intertwined with a solidly dry texture, powerful but still elegant. It will repay aging. Drink from 2016.",Monte da Baía Reserva
1027,Wines & Winemakers,Portugal,91,"A rich wine that is made by the Abreu Callado charity foundation. It has dark black currant fruits, big tannins and an elegant feel. With its structure, minerality and ripe, juicy fruitiness, it is finely structured and ageworthy. Drink from 2017.",Abreu Callado Reserva
1028,McIntyre Vineyards,US,91,"You can criticize this as being too full-bodied for a Pinot Noir. Some will find it Grenache-like, with its lush, jammy flavors of cherries, raspberries and oak. But what can't be denied is how delicious it is. The fruitiness, acidity and tannins suggest pairing with charbroiled lamb chops or steak. Drink now–2020.",Estate 25th Anniversary
1029,Palmeri,US,91,"Palmeri has a good history with Syrah, and this 2011 is right up there. With rich, complex blackberry and blueberry jam, cassis, salted grilled beef, black pepper and smoky oak flavors, it is sophisticated enough to drink with upscale fare. It should age well through 2020.",Van Ness Vineyard
1030,Quinta do Portal,Portugal,91,"A powerfully tannic wine, full of the mineral texture and dark structure of a fine Douro wine. It has rich berry and plum skin flavors with underlining from acidity. The tannins, still young, promise aging. Drink from 2017.",Reserva
1031,Quinta Nova de Nossa Senhora do Carmo,Portugal,91,"Already impressive, this wine is rich and packed with tannins and fruit. The structure gives a dry core that is cushioned by the sweet blackberry fruit flavors. The end shows the tannins again, along with fresh acidity, both suggesting aging. Drink from 2016.",Reserva
1032,Emil Reichart,Germany,91,"Dried herbs accent notes of lemon and apple on this concentrated off-dry Riesling. The palate builds in intensity, with juicy flavors of peach and tangerine glazed with streaks of honey and wax. The finish is long, with bristling lemon-lime acidity.",Single Vineyard Series Spätlese
