Unnamed: 0,winery,country,points,description,designation
0,Heitz,US,96,"This tremendous 100% varietal wine hails from Oakville and was aged over three years in oak. Juicy red-cherry fruit and a compelling hint of caramel greet the palate, framed by elegant, fine tannins and a subtle minty tone in the background. Balanced and rewarding from start to finish, it has years ahead of it to develop further nuance. Enjoy 2022–2030.",Martha's Vineyard
1,Bodega Carmen Rodríguez,Spain,96,"Ripe aromas of fig, blackberry and cassis are softened and sweetened by a slathering of oaky chocolate and vanilla. This is full, layered, intense and cushioned on the palate, with rich flavors of chocolaty black fruits and baking spices. A toasty, everlasting finish is heady but ideally balanced. Drink through 2023.",Carodorum Selección Especial Reserva
2,Macauley,US,96,"Mac Watson honors the memory of a wine once made by his mother in this tremendously delicious, balanced and complex botrytised white. Dark gold in color, it layers toasted hazelnut, pear compote and orange peel flavors, reveling in the succulence of its 122 g/L of residual sugar.",Special Selected Late Harvest
3,Ponzi,US,96,"This spent 20 months in 30% new French oak, and incorporates fruit from Ponzi's Aurora, Abetina and Madrona vineyards, among others. Aromatic, dense and toasty, it deftly blends aromas and flavors of toast, cigar box, blackberry, black cherry, coffee and graphite. Tannins are polished to a fine sheen, and frame a finish loaded with dark chocolate and espresso. Drink now through 2032.",Reserve
4,Domaine de la Bégude,France,95,"This is the top wine from La Bégude, named after the highest point in the vineyard at 1200 feet. It has structure, density and considerable acidity that is still calming down. With 18 months in wood, the wine has developing an extra richness and concentration. Produced by the Tari family, formerly of Château Giscours in Margaux, it is a wine made for aging. Drink from 2020.",La Brûlade
5,Numanthia,Spain,95,"Deep, dense and pure from the opening bell, this Toro is a winner. Aromas of dark ripe black fruits are cool and moderately oaked. This feels massive on the palate but sensationally balanced. Flavors of blackberry, coffee, mocha and toasty oak finish spicy, smooth and heady. Drink this exemplary Toro through 2023.",Numanthia
6,Maurodos,Spain,95,"Slightly gritty black-fruit aromas include a sweet note of pastry along with a hint of prune. Wall-to-wall saturation ensures that all corners of one's mouth are covered. Flavors of blackberry, mocha and chocolate are highly impressive and expressive, while this settles nicely on a long finish. Drink now through 2024.",San Román
7,Bodega Carmen Rodríguez,Spain,95,"Lush cedary black-fruit aromas are luxe and offer notes of marzipan and vanilla. This bruiser is massive and tannic on the palate, but still lush and friendly. Chocolate is a key flavor, while baked berry and cassis flavors are hardly wallflowers. On the finish, this is tannic and deep as a sea trench. Drink this saturated black-colored Toro through 2023.",Carodorum Único Crianza
8,Bergström,US,95,"This re-named vineyard was formerly bottled as deLancellotti. You'll find striking minerality underscoring chunky black fruits. Accents of citrus and graphite comingle, with exceptional midpalate concentration. This is a wine to cellar, though it is already quite enjoyable. Drink now through 2030.",Silice
9,Blue Farm,US,95,"The producer sources from two blocks of the vineyard for this wine—one at a high elevation, which contributes bright acidity. Crunchy cranberry, pomegranate and orange peel flavors surround silky, succulent layers of texture that present as fleshy fruit. That delicately lush flavor has considerable length.",Gap's Crown Vineyard
10,Borgo del Tiglio,Italy,95,"Elegance, complexity and structure come together in this drop-dead gorgeous winethat ranks among Italy's greatest whites. It opens with sublime yellow spring flower, aromatic herb and orchard fruit scents. The creamy, delicious palate seamlessly combines juicy white peach, ripe pear and citrus flavors while white almond and savory mineral notes grace the lingering finish.",Ronco della Chiesa
11,Patricia Green Cellars,US,95,"From 18-year-old vines, this supple well-balanced effort blends flavors of mocha, cherry, vanilla and breakfast tea. Superbly integrated and delicious even at this early stage, this wine seems destined for a long and savory cellar life. Drink now through 2028.",Estate Vineyard Wadensvil Block
12,Patricia Green Cellars,US,95,"A standout even in this terrific lineup of 2015 releases from Patricia Green, the Weber opens with a burst of cola and tobacco scents and accents. It continues, subtle and detailed, with flavors of oranges, vanilla, tea and milk chocolate discreetly threaded through ripe blackberry fruit.",Weber Vineyard
13,Vignobles Brumont,France,95,This wine is in peak condition. The tannins and the secondary flavors dominate this ripe leather-textured wine. The fruit is all there as well: dried berries and hints of black-plum skins. It is a major wine right at the point of drinking with both the mature flavors and the fruit in the right balance.,Château Montus Prestige
14,Domaine Serene,US,95,"With its sophisticated mix of mineral, acid and tart fruits, this seductive effort pleases from start to finish. Supple and dense, it's got strawberry, blueberry, plum and black cherry, a touch of chocolate, and that underlying streak of mineral. All these elements are in good proportion and finish with an appealing silky texture. It's delicious already, but give it another decade for full enjoyment. Drink now through 2028.",Grace Vineyard
15,Bergström,US,95,"First made in 2006, this succulent luscious Chardonnay is all about minerality. It's got a rich core of butterscotch and the seemingly endless layers of subtle flavors that biodynamic farming can bring. It spends 18 months on the lees prior to bottling. Drink now through 2028.",Sigrid
16,Hall,US,95,"This blockbuster, powerhouse of a wine suggests blueberry pie and chocolate as it opens in the glass. On the palate, it's smooth and seductively silky, offering complex cedar, peppercorn and peppery oak seasonings amidst its dense richness. It finishes with finesse and spice.",Rainin Vineyard
17,Valduero,Spain,95,"Nicely oaked blackberry, licorice, vanilla and charred aromas are smooth and sultry. This is an outstanding wine from an excellent year. Forward barrel-spice and mocha flavors adorn core blackberry and raspberry fruit, while this runs long and tastes vaguely chocolaty on the velvety finish. Enjoy this top-notch Tempranillo through 2030.",6 Años Reserva Premium
18,Château Lagrézette,France,95,"Coming from a seven-acre vineyard named after the dovecote on the property, this is a magnificent wine. Powered by both fruit tannins and the 28 months of new wood aging, it is darkly rich and with great concentration. As a sign of its pedigree, there is also elegance here, a restraint which is new to this wine. That makes it a wine for long-term aging. Drink from 2022.",Le Pigeonnier
19,Gary Farrell,US,95,"This fresh and lively medium-bodied wine is beautifully crafted, with cherry blossom aromas and tangy acidity. Layered and seductive, it offers a crisp mix of orange peel, cherry, pomegranate and baking spice flavors that are ready for the table or the cellar.",Gap's Crown Vineyard
20,Heitz,US,95,"Heitz has made this stellar rosé from the rare Grignolino grape since 1961. Ruby grapefruit-red, it's sultry with strawberry, watermelon, orange zest and salty spice flavor, highlighted with vibrant floral aromas.",Grignolino
21,Muga,Spain,95,"Alluring, complex and powerful aromas of grilled meat, berries, tea, smoke, vanilla and spice cover every base. An intense palate is concentrated but still elegant. Blackberry, molasses and mocha flavors finish with chocolaty oak notes, fine tannins and overall cohesion. Drink this special Rioja from 2020 through 2035.",Prado Enea Gran Reserva
22,Numanthia,Spain,95,"Tarry blackberry and cheesy oak aromas are appropriate for a wine of this size and magnitude. In the mouth, this Tinta de Toro is expansive and grabby, with bullish tannins. Slightly salty earthy accents come with core blackberry flavors and notes of baking spices and chocolate, while on the finish this is long, chocolaty, delicious and not too hard or tannic. Drink through 2023.",Termanthia
23,Center of Effort,US,95,"The apogee of this ambitious winery's white wine efforts, this bottling of just two barrels of Clone 5 shows focused marzipan, marcona almond and white peach notes on the nose. The palate sizzles with saltiness and a lemony acidity that cuts through its brown butter richness with finesse. The finish is luxurious and long.",Giallo Solare
24,Comartin,US,95,"San Jose-based producer Adam Comartin heads 1,100 feet up into the mountains to source fruit for this tremendous wine, which offers wild cherry, sage, and eucalyptus scents on the nose. Ripe black plum and strawberry fruit lead the palate, followed by acid-driven waves of juniper, pine and bay leaf, finishing with a menthol-like sensation.",R-Bar-R Ranch
25,Kumeu River,New Zealand,94,"Yields were down in 2015, but intensity is up, giving this medium-bodied, silky wine the potential to drink well through at least 2025. Hickory smoke outlines white peach before ending in a long flurry of lime zest.",Maté's Vineyard
26,Bergström,US,94,"Bergström has made a Shea designate since 2003, intent on showcasing a “pretty” style of the vineyard. Here are lovely aromatics, with grape jelly, rose petals and plum in the nose, and a complex run of red fruits in the mouth. Streaks of cola, brown sugar and more come up in a generous finish.",Shea Vineyard
27,Ponzi,US,94,"Focused and dense, this intense wine captures the essence of ripe raspberries. Aged in 50% new French oak, it's got a strong vein of coffee and mocha. The flavors broaden out and penetrate, finishing with highlights of cedar, cinnamon and dark chocolate. Drink now through the 2020s, but decant if you want the full expression.",Abetina
28,Roar,US,94,"Cranberry, baked rhubarb, anise and crushed slate aromas show on the nose of this always-excellent bottling from the Franscioni family. The palate abounds with energy, driving black raspberry fruit accented with earthy loam, fennel, oregano and juniper through a compellingly round midpalate.",Garys' Vineyard
29,Saviah,US,94,"This standout Rocks District wine brings earth shaking aromas of black-olive brine, tapenade, green olive, stargazer lilies, orange peel and crushed gravel. The smoked meat, charcuterie and blue-fruit flavors don't hold back, bringing a lovely sense of texture and detail. It's an intense wine that completely demands your attention.",The Funk Estate
30,Villa Melnik,Bulgaria,90,"This Bulgarian Mavrud presents the nose with suggestions of dried cherry, black plum, freshly ground black pepper and a whiff of eucalyptus. In the mouth it is balanced with soft tannins mingling with dried cherry, cassis and black plum.",Bergulé
31,Zepaltas,US,90,"Steely and perfumed, this wine sees only 20% new French oak, remaining vibrantly fresh. Baked apple and lemon pith veer into grapefruit on the palate, with spiciness to the finish that's both brash and loud.",Babushka
32,Abbadia Ardenga,Italy,90,"Underbrush, scorched earth, menthol and plum steeped in spirits are some of the aromas that unfold on the glass. The big, chewy palate doles out ripe wild cherry, raspberry jam, ground pepper and licorice alongside firm, velvety tannins. You'll also detect the warmth of alcohol on the finish.",Vigna Piaggia
33,Bouvet-Ladubay,France,90,"Pale in color, this is nutty in character, with a warm and rounded hint of red fruits. The wine has a soft, while still fresh, aftertaste. It is aged in cellars in Saumur on the Loire river.",Nonpareil Trésor Rosé Brut
34,Buty,US,90,"The aromas entice with notes of wet stone, honeysuckle, chamomile and stone fruit. The palate is generous in flavor and feel, showing a fine sense of balance.",Conner Lee Vineyard
35,Carillon,Italy,90,"Forest floor, tilled soil, mature berry and a whiff of new leather combine on this. The ripe palate offers fleshy black cherry, dried aromatic herb and tobacco, while fine-grained tannins give the finish some grip. Drink 2018–2023.",Riserva
36,Clos de L'Oratoire des Papes,France,90,"Gingery spice notes accent fresh pear and melon fruit in this medium- to full-bodied wine. It's round on the palate but not flabby, with a warm, spicy finish. Drink now.",
37,Avignonesi,Italy,90,"Aromas of forest floor, violet, red berry and a whiff of dark baking spice unfold in the glass while wild cherry, black raspberry, ground pepper and star anise drive the palate. Framed in firm, fine-grained tannins, this is a classic Tuscan red. Drink through 2020.",
38,Casina di Cornia,Italy,90,"This has a charming nose that boasts rose, violet and red berry while the juicy, easy-drinking palate offers ripe wild cherry, chopped mint, white pepper and a hint of star anise. There isn't much complexity but it is savory and balanced, with fresh acidity and supple tannins.",
39,Castello di Monterinaldi,Italy,90,"This bright, savory wine delivers aromas and flavors of juicy wild cherry, black raspberry, violet, white pepper and mocha. Polished tannins provide the framework. Enjoy through 2020.",Riserva
40,Don Bernardino,Spain,90,"Earthy plum and cherry aromas score points for being clear and direct. The palate on this varietal Mencía is round, smooth and just right. Lightly briny, earthy plum and cherry flavors hold steady on the finish, with a dash of saltiness.",Amandi
41,González Byass,Spain,90,"This comes across wide and expansive as it lazily exudes oily aromas of hazelnut and toffee. A plump palate is not overly cutting or demanding, while flavors of lightly salted nuts and buttered toast end with toffee and peanut flavors.",Alfonso Oloroso Seco
42,Huston,US,90,"This is an aromatic brooder with aromas of scorched earth, plum, dried flowers and green herbs. It's full in feel with dense, dark-fruit flavors, tightly coiled tannins and tart acids—a pleasing example of the variety.",Private Reserve
43,Rignana,Italy,90,"Aromas of dark-skinned berry, rose and wild herb lead the nose. The round, juicy palate doles out ripe black cherry, fleshy raspberry, white pepper and clove while polished tannins provide a smooth, velvety framework. Enjoy through 2019.",Riserva
44,Tardieu-Laurent,France,90,"Dark in color and in flavor profile, this medium-bodied Cornas boasts aromas and flavors reminiscent of chocolate fudge, espresso and plummy fruit, all framed by soft, dusty tannins. Drink now–2025.",Coteaux
45,Vignavecchia,Italy,90,"A blend of 90% Sangiovese and 10% Canaiolo, this opens with aromas of violet, mature plum, espresso and a whiff of forest floor. The firm palate offers dried black cherry, ground pepper, toast and clove while packed, fine-grained tannins provide support. Drink through 2020.",Vigneto Odoardo Beccari Riserva
46,Banfi,Italy,90,"Sunbaked earth, ripe berry, baking spice and a whiff of menthol meld in the glass. The juicy palate offers red cherry, pomegranate, star anise, mocha and a hint of tobacco alongside fine-grained tannins.",Poggio alle Mura
47,Brandlin,US,90,"Blended with 9% Malbec, 9% Cabernet Franc and 5% Petit Verdot, this is a perennial classic for the winery, the sister brand of Cuvaison. Juicy in cherry and cassis, it sustains big, pillowy tannins and tar, suggesting more time for the fruit to match up with the structure. Drink through 2020.",Estate Grown
48,Brunelli Martoccia,Italy,90,"Ripe dark-skinned berry, forest floor and cooking spice aromas lead the nose along with a whiff of new leather. The chewy palate offers fleshy black cherry, cinnamon, vanilla and a hint of tobacco while polished tannins provide the framework. This is already accessible so no need to cellar it for years. Best through 2021.",
49,Canvasback,US,90,"The aromas of blue fruit, herbs and spice are initially under tight restraint. The flavors are full, with the tannins simultaneously firm and fine grained. It shows good length.",
50,Capanne Ricci,Italy,90,"This robust red opens with aromas of espresso, plum cake, toast and dark spice. The hearty palate offers blackberry jam, licorice, vanilla and mocha alongside firm fine-grained tannins. A coffee note closes the finish.",Riserva
51,Chartron et Trébuchet,France,90,"This structured, complex Chardonnay is packed with minerality and considerable weight. The tight texture and almost tannic character will soften over the next few months. Full of potential, it's drinkable now but will be so much better from 2017.",
52,Cherrier Frères,France,90,"This ripe, full-bodied wine has ripe green fruits that are lifted by lime and made richer by apricot. Still young, with a concentrated structure, it's going to develop into a full, beautifully fruity wine. The name of the wine means the size of a parcel that demands the work of seven men for a day. Drink from 2017.",Les 7 Hommes
53,Clement et Florian Berthier,France,90,"With its light color and cool feel, this well-balanced wine comes from a parcel of 30-year-old vines. The smoky tannins and intense acidity give a wine that will develop well and slowly. It's still young with its red-berry fruits and fresh aftertaste. Drink from 2018.",L'Inédit
54,De Loach,US,90,"There's a lot to like in this nicely priced white, a blend of several regional vineyards. A taste of hazelnut expands on the palate to meet creamy Tahitian vanilla. Approachably round, this crowd-pleasing wine finishes in measured, integrated oak.",
55,DeLille,US,90,"A blend of Cabernet from Grand Ciel (31%), Ciel du Cheval (30%), Upchurch (28%) and Klipsun (11%) vineyards, wood spice aromas start out up front. The cherry flavors are light and elegant, with the tannins bringing some grip.",Four Flags
56,Domaine Vacheron,France,90,"Delicious while also young and textured, this wine comes from biodynamically grown grapes. It has a strong sense of minerality as well as intense citrus and green fruits. It's tight at the moment and needs to round out, so drink from 2018.",Le Pavé
57,Dr. Konstantin Frank,US,90,"While exuberantly fruity, almost tropical on the nose, there's a crystalline edge to this dry Riesling that renders it especially refreshing. It's vibrant and light footed, brightened by a lingering honey note on the finish.",Reserve
58,Efeste,US,90,"Cabernet makes up just over half of this blend. Aromas of black cherries, herbs and minerals are followed by plush-feeling dark-fruit flavors and backed by firm tannins. Drink now.",Final Final
59,Fattoria di Magliano,Italy,90,"This savory blend of 40% Merlot, 30% Cabernet Sauvignon, 25% Cabernet Franc and 5% Syrah opens with aromas of roasted coffee bean, leather, tobacco and dark woodland berry. The chewy palate offers juicy plum, cassis and clove alongside polished tannins. Drink through 2019.",Poggio Bestiale
60,Matias Riccitelli,Argentina,91,"Concentrated, ripe blackberry and cassis aromas come with peppery spice and cedary oak notes. This is big and generous on the palate, with roasted, well-oaked blackberry flavors. A touch of heat lends sizzle to the finish. Drink through 2020.",The Apple Doesn't Fall Far From The Tree
61,Moorooduc,Australia,91,"Moorooduc's estate Pinot Noir is a solid value among the boutique offerings from the Mornington Peninsula. There's a supple cushioning of flesh wrapped around a firm backbone of acid, while the flavors run from black cherry and mint through earthier notes of brown sugar and roasted parsnip. Drink now through 2020.",
62,Navarro Correas,Argentina,91,"Smoky aromas of fresh-cut wood blend with berry and cassis form a welcoming, generous bouquet. This feels lively on the palate, albeit tartaric. Oaky plum, cassis and vanilla flavors finish full and agreeable. Drink through 2019.",Alegoría Gran Reserva
63,Domaine Chenevières,France,91,"L'Homme Mort is a northern extension of the Fourchaume Premier Cru vineyard, so called because this was where a local lord dispensed justice by death. It often produces cooler wines such as this. It is tight, with toasted bread hints and with a strongly tangy character. It does need to develop and shouldn't be drunk before 2018.",L'Homme Mort Premier Cru
64,Herdade do Rocim,Portugal,91,"This is a super-ripe, still very young wine. It's showing all its concentrated fruits, wood aging flavors and dense texture as well as the firm tannins that will allow it to age. With its combination of black plum skin, blackberry and dark concentration, leave the wine until 2018.",
65,Jason-Stephens,US,91,"Fresh boysenberries and a blueberry sorbet character mix with notes of minty tarragon, dill and hot gravel on the nose of this wine, from an area between Gilroy and Morgan Hill. Peppercorns are prominent on the relatively light palate, along with tobacco, espresso and boysenberry.",Estate Select
66,Louis Max,France,91,"The steely character of a young Chablis is very apparent in this wine. It is crisp, lemon flavored and with a mineral edge. The wine has a juicy freshness, still young at heart and needing to age. Drink from 2018.",Fourchaume Premier Cru
67,Michael Mondavi Family Estate,US,91,"From the producer's monumental Atlas Peak vineyard, this is a tightly wound, solidly constructed mountain Cab, blended with a handful of Petit Verdot. Tobacco, black tea and a sliver of coconut intermingle around a medium-bodied whole that will benefit from cellaring, through 2021.",Animo
68,Panther Creek,US,91,"Big, bold, dark and chewy, this builds upon substantial black-cherry fruit and supporting acids. Still knitting together, it shows highlights of cedar and tobacco, along with thick tannins. Give this a couple more years of bottle age, and drink after 2018.",Schindler Vineyard
69,Provenance Vineyards,US,91,"A juiciness of cherry and vanilla spark the opening of this wine, a celebration of the vintage, appellation and in this case, fruit-forwardness of the variety. With a backbone of oak and cedar, it has smooth tannins and medium weight, finishing in mocha chocolate. Drink now through 2022.",Barrel Select
70,Raymond,US,91,"Sweetened tannins highlight a depth of chocolate and blackberry in this 100% varietal wine made in small amounts. Soft and juicy, it crafts a balance of richness and density around elegant spicy clove and cinnamon.",District Collection
71,Red Car,US,91,"This wine draws from a handful of tremendous vineyard sites, including the producer's estate, Platt and Clary Ranch, all cool-climate and windswept. It's a tight, light and minimally messed-with wine, bright in cherry, pomegranate and rose.",
72,Silvano Bolmida,Italy,91,"This offers aromas of red rose, wild berry, dark cooking spice and a whiff of sun baked earth. The ripe palate offers black cherry marinated in spirits, licorice, game and a hint of chocolate alongside velvety tannins. The warmth of alcohol closes the finish. Drink 2018–2029.",Bussia Riserva
73,Trinity Vineyards,US,91,"Massively fruity, this is an apple/pear bonanza, fleshy and almost lasciviously delicious. The huge fruit flavors convey an impression of sweetness, though this is not identified as off dry. It has tremendous density and length.",
74,Adega Cooperativa de Borba,Portugal,91,"It is the ripe dark Alicante Bouschet that dominates this firmly structured wine. It is packed with tannins along with a hugely dense texture and concentrated juicy berry flavors. It is very firm, still young. Wait until 2017.",Premium
75,Archery Summit,US,91,"An elegant blend from different estate vineyards, this widely available cuvée brings sturdy tannins and red currant fruit, highlighted with pretty baking spices. It would be an ideal match for roast duck with an orange sauce.",Premier Cuvée
76,Aubry,France,91,"This wine is bone-dry, although with some age the shock of the acidity has been rounded out by a hint of toast. It's linear, fresh and intensely crisp, with citrus and almond tones. Drink this wine from a good vintage now.",Le Nombre d'Or Brut Nature
77,B Cellars,US,91,"Given four months in concrete egg, this is an exotically crisp and textured white, lean and high in acidity with plenty of mouthcoating body to find its balance. Lemon, grapefruit and tangerine are the highlights, finished in refreshing layers of white peach.",Juliana Vineyard
78,B Side,US,91,"This wine over-delivers in quality for the price. It's made from mostly Cabernet Sauvignon, with handfuls of Merlot, Malbec, Petit Verdot and Cabernet Franc blended in to good effect. The whole combines into layers of chocolate and graham cracker, dappled in vanilla and jam. Thick tannins suggest a swirl or two of the glass. The finish is all tobacco.",
79,Bel Colle,Italy,91,"Underbrush, smoke, mocha and dark fruit aromas lead the nose and carry over to the ripe palate along with dried black cherry, licorice and clove. Firm, velvety tannins provide the framework. Drink 2018–2028.",Boscato
80,Bethel Heights,US,91,"Generous black-cherry fruit anchors this barrel-aged wine that remains tartly acidic, with pretty accents of toast and mocha. Focused, young and fresh, it should drink optimally 2018–2028.",Aeolian
81,Binyamina,Israel,91,"Dark red violet in color, this wine has aromas of cherry, lavender and rose petal. It is a well-balanced wine with flavors of black cherry, raspberry, Turkish delight and herbes de Provence. Silky tannins coat the palate into the lasting finish, which is punctuated by a note of bright cherry.",Reserve
